{
  "type": {
    "name": "SimpleSearch",
    "version": "1.0"
  },
  "version": "1.2",
  "name":"Bootstrapped ERM Agreements Def",
  "definition":{
    "baseUrl":"/erm/sas",
    "resource": "agreement",
    "results": {
      "columns": [
        {
          "name":"agreementName",
          "label": "Agreement name",
          "accessPath":"name",
          "valueType": "String"
        }
      ]
    },
    "filters": {
      "columns": [
        {
          "name":"agreementName",
          "label": "Agreement name",
          "filterPath":"name",
          "valueType": "String",
          "comparators": ["=~", "!~"]
        }
      ]
    },
    "sort": {
      "columns": [
        {
          "name":"agreementName",
          "sortPath":"name",
          "sortTypes": ["asc", "desc"]
        }
      ]
    },
    "configurableProperties": {
      "urlLink": {
        "configurable": true
      },
      "numberOfRows": {
        "configurable": true,
        "defValue": 5
      }
    }
  }
}